voice title,voice description,reference_audio,preview_image (svdq_fluxdev_fp4),SVDQ-Images,preview_audio (tts_mgm),Tags,MGM WER
Indifferent Anime Senpai (Teen Male),"Calm, smooth, slightly deep teen male audio. A cool, detached voice, acknowledging his admirers with a bored, monotone, but effortlessly charming tone. Slow, ""cool"" pace.",https://s3.renderplatform.com/public-testing/examples/2025-09-24/55_indifferent-anime-senpai-teen-male.mp3,https://s3.renderplatform.com/user-assets/preview/gr_8979902fb7a04917ad22a94410da6804.png,,,,
Strict Victorian Governess (Middle-aged Female),"Crisp, sharp, authoritative middle-aged female audio. A thin, severe voice (posh British RP), emphasizing discipline, pronunciation, and posture with zero warmth. Slow, clipped pace.",https://s3.renderplatform.com/public-testing/examples/2025-09-24/56_strict-victorian-governess-middle-aged-female.mp3,https://s3.renderplatform.com/user-assets/preview/gr_1f978546de5f415ba21a391827ae534e.png,,,,
Gushing Movie Review Vlogger (Middle-aged Male),"Energetic, loud, enthusiastic middle-aged male audio. A fast, emotional voice, describing his favorite film with hyperbole, often pausing just to yell ""Wow!"" Fast, dynamic pace.",https://s3.renderplatform.com/public-testing/examples/2025-09-24/57_gushing-movie-review-vlogger-middle-aged-male.mp3,https://s3.renderplatform.com/user-assets/preview/gr_506aa7f1632b45afa0f83caa749c5ef8.png,,,,
Kindly Village Priest (Senior Male),"Soft, warm, resonant senior male audio. A gentle, reassuring voice (perhaps Irish accent), offering comfort, wisdom, and gentle humor. Slow, measured, kind pace.",https://s3.renderplatform.com/public-testing/examples/2025-09-24/58_kindly-village-priest-senior-male.mp3,https://s3.renderplatform.com/user-assets/preview/gr_4d2b2f99affd4621aaf6cd9f74370b48.png,,,,
Terrified Babysitter Phone Call (Teen Female),"High-pitched, breathless, whispering teen female audio. A frantic, crying whisper into a phone, describing a threat (""The call is coming from *inside the house*!""). Fast, panicked, shaky pace.",https://s3.renderplatform.com/public-testing/examples/2025-09-24/59_terrified-babysitter-phone-call-teen-female.mp3,https://s3.renderplatform.com/user-assets/preview/gr_0852327dd0ac4a84bb41df6d6b0579e5.png,,,,
Cynical Space Cargo Hauler (Middle-aged Male),"Relaxed, conversational middle-aged male audio (over comms). A weary, slightly gravelly voice (Southern accent), complaining about the corporation, the route, and the cargo. Moderate, cynical pace.",https://s3.renderplatform.com/public-testing/examples/2025-09-24/60_cynical-space-cargo-hauler-middle-aged-male.mp3,https://s3.renderplatform.com/user-assets/preview/gr_d086c9fd318946a590601dd25d58e414.png,,,,
Ambitious Sorceress Apprentice (Teen Female),"Clear, articulate, and ambitious teen female audio. Her voice is confident, slightly arrogant, and eager to prove her power, enunciating incantations perfectly. Moderate, precise pace.",https://s3.renderplatform.com/public-testing/examples/2025-09-24/61_ambitious-sorceress-apprentice-teen-female.mp3,https://s3.renderplatform.com/user-assets/preview/gr_bdf3630918d8453aad6a3c1e0255145c.png,,,,
Grumpy Retired Super Hero (Senior Male),"Deep, gravelly, tired senior male audio. A powerful voice gone to seed, complaining about his back, modern heroes, and the state of the world. Slow, grumbling pace.",https://s3.renderplatform.com/public-testing/examples/2025-09-24/62_grumpy-retired-super-hero-senior-male.mp3,https://s3.renderplatform.com/user-assets/preview/gr_b154ffabf3b647fca18a612d90d701af.png,,,,
Female Steampunk Airship Captain (Middle-aged Female),"Crisp, commanding, aristocratic middle-aged female audio. A proper, adventurous voice (British RP accent), shouting orders about ""aether-sails"" and ""boiler pressure."" Fast, clipped, commanding pace.",https://s3.renderplatform.com/public-testing/examples/2025-09-24/63_female-steampunk-airship-captain-middle-aged-female.mp3,https://s3.renderplatform.com/user-assets/preview/gr_e478d424444e45efb3238be70185f991.png,,,,
Annoying Younger Sibling (Teen Male),"Nasally, high-pitched, mocking teen male audio. A repetitive, energetic voice, intentionally repeating everything said in a silly tone just to annoy. Fast, erratic, annoying pace.",https://s3.renderplatform.com/public-testing/examples/2025-09-24/64_annoying-younger-sibling-teen-male.mp3,https://s3.renderplatform.com/user-assets/preview/gr_30f54bb3377a4a0fb2b0388beac7b7a5.png,,,,
Proud Suburban Dad (Middle-aged Male),"Warm, hearty, slightly booming middle-aged male audio. A voice filled with earnest pride, boasting about his lawn, his new grill, or his kid's minor achievement. Moderate, enthusiastic pace.",https://s3.renderplatform.com/public-testing/examples/2025-09-24/65_proud-suburban-dad-middle-aged-male.mp3,https://s3.renderplatform.com/user-assets/preview/gr_aea305188df14aed89d5f7224473676e.png,,,,
Sassy Fantasy Tavern Wench (Middle-aged Female),"Hearty, boisterous, welcoming middle-aged female audio. A loud, clear voice with a rustic accent, trading insults, taking orders, and laughing loudly. Fast, conversational pace.",https://s3.renderplatform.com/public-testing/examples/2025-09-24/67_sassy-fantasy-tavern-wench-middle-aged-female.mp3,https://s3.renderplatform.com/user-assets/preview/gr_e76406751bf24b1fac66da0bcba5af39.png,,,,
Corrupt Police Detective (Middle-aged Male),"Low, gravelly, intimate middle-aged male audio. A quiet, menacing voice (regional accent), suggesting a bribe or threatening a witness with calm confidence. Slow, deliberate, smooth pace.",https://s3.renderplatform.com/public-testing/examples/2025-09-24/68_corrupt-police-detective-middle-aged-male.mp3,https://s3.renderplatform.com/user-assets/preview/gr_563b9ceda8ec40c7917068ad349fd838.png,,,,
Nosy Neighborhood Watch Captain (Senior Female),"Sharp, nasally, suspicious senior female audio. A high-pitched, intrusive voice, describing minor infractions (""at 10:04 PM!"") with grave seriousness. Fast, clipped, judgmental pace.",https://s3.renderplatform.com/public-testing/examples/2025-09-24/69_nosy-neighborhood-watch-captain-senior-female.mp3,https://s3.renderplatform.com/user-assets/preview/gr_9fbd3cb2ca6549839df636822a768035.png,,,,
Old Blues Musician (Senior Male),"Very deep, raspy, rhythmic senior male audio. A gravelly, soulful voice, speaking slowly about hard times and the devil. Slow, rhythmic, warm pace.",https://s3.renderplatform.com/public-testing/examples/2025-09-24/70_old-blues-musician-senior-male.mp3,https://s3.renderplatform.com/user-assets/preview/gr_6533f68d08914e1ab210d4f88fb0661e.png,,,,
Mysterious Anime Transfer Student (Teen Female),"Calm, smooth, monotone teen female audio. A cool, detached voice, speaking formally and cryptically, revealing nothing. Slow, precise, emotionless pace.",https://s3.renderplatform.com/public-testing/examples/2025-09-24/71_mysterious-anime-transfer-student-teen-female.mp3,https://s3.renderplatform.com/user-assets/preview/gr_d27db9f64238463cbbfedbd2bc5de6fb.png,,,,
Giddy Lottery Winner (Middle-aged Female),"High-pitched, breathless, screaming middle-aged female audio. A voice cracking with joyous disbelief, dissolving into laughter, shouting, and incoherent plans. Very fast, manic, loud pace.",https://s3.renderplatform.com/public-testing/examples/2025-09-24/72_giddy-lottery-winner-middle-aged-female.mp3,https://s3.renderplatform.com/user-assets/preview/gr_fd9eb754187f4902a97e8022e9c23c3d.png,,,,
Haunted Toy Maker (Senior Male),"Quiet, frail, whispering senior male audio. An ancient, sad voice (perhaps German/Swiss accent), speaking of his creations with a creepy, paternal fondness. Slow, hesitant pace.",https://s3.renderplatform.com/public-testing/examples/2025-09-24/73_haunted-toy-maker-senior-male.mp3,https://s3.renderplatform.com/user-assets/preview/gr_ab592fea00da4d7ebe0891181608cacc.png,,,,
Teenage Goth Poet (Teen Male),"Slow, deep, monotone teen male audio. A deliberately slow, pretentious voice, reading terrible, dark poetry with exaggerated, false gravitas. Very slow, melancholic pace.",https://s3.renderplatform.com/public-testing/examples/2025-09-24/74_teenage-goth-poet-teen-male.mp3,https://s3.renderplatform.com/user-assets/preview/gr_bd351a4438a24cd483fb78779d5de815.png,,,,
Tired Morning Radio DJ (Middle-aged Male),"Low, raspy ""radio voice"" middle-aged male audio. A forced, energetic delivery that is clearly masking exhaustion; punctuated by yawns and coffee sips. Fast, but low-energy pace.",https://s3.renderplatform.com/public-testing/examples/2025-09-24/75_tired-morning-radio-dj-middle-aged-male.mp3,https://s3.renderplatform.com/user-assets/preview/gr_8b8d7d6e622b4c30b4b9f566a06492eb.png,,,,
Sarcastic Animated Brainiac (Teen Female),"Nasally, fast, articulate teen female audio. A nerdy, slightly arrogant voice, delivering complex solutions and sarcastic insults at the same rapid pace. Very fast, precise.",https://s3.renderplatform.com/public-testing/examples/2025-09-24/76_sarcastic-animated-brainiac-teen-female.mp3,https://s3.renderplatform.com/user-assets/preview/gr_6bbcd487da7c4da1ae29673babc634dc.png,,,,
Cyberpunk Street Samurai (Middle-aged Male),"Deep, gravelly, synthesized middle-aged male audio. A tough, professional voice (slight distortion), speaking in clipped, stoic, professional threats. Slow, deliberate, menacing pace.",https://s3.renderplatform.com/public-testing/examples/2025-09-24/77_cyberpunk-street-samurai-middle-aged-male.mp3,https://s3.renderplatform.com/user-assets/preview/gr_a51c45ff284441d79ef6aef7dbcee4ca.png,,,,
Gentle Giant Anime Strongman (Middle-aged Male),"Very deep, slow, booming middle-aged male audio. A simple, kind, and gentle voice that contrasts with his implied size; speaks slowly and politely. Very slow pace.",https://s3.renderplatform.com/public-testing/examples/2025-09-24/78_gentle-giant-anime-strongman-middle-aged-male.mp3,https://s3.renderplatform.com/user-assets/preview/gr_88ad732a230f415f94805b759f3ff033.png,,,,
Twitch Stream Moderator (Middle-aged Female),"Calm, authoritative, monotone middle-aged female audio. A tired, firm voice, welcoming new subs and banning trolls with the same flat, emotionless delivery. Moderate, steady pace.",https://s3.renderplatform.com/public-testing/examples/2025-09-24/79_twitch-stream-moderator-middle-aged-female.mp3,https://s3.renderplatform.com/user-assets/preview/gr_2ec978ab453c4b7fba0b1759f9dc5eba.png,,,,
Victorian Factory Owner (Senior Male),"Gruff, booming, arrogant senior male audio. A harsh, upper-class British accent, demanding more work for less pay, dismissing all complaints. Fast, barking pace.",https://s3.renderplatform.com/public-testing/examples/2025-09-24/80_victorian-factory-owner-senior-male.mp3,https://s3.renderplatform.com/user-assets/preview/gr_73f093101f414ec1b7231c37d17ae25c.png,,,,
Enthusiastic Teenage Camp Counselor (Teen Male),"Loud, energetic, projecting teen male audio. A classic ""camp voice,"" artificially enthusiastic, leading repetitive songs, and shouting encouragement. Fast, peppy pace.",https://s3.renderplatform.com/public-testing/examples/2025-09-24/81_enthusiastic-teenage-camp-counselor-teen-male.mp3,https://s3.renderplatform.com/user-assets/preview/gr_782e421ae23e4279aa152080c07e6a6e.png,,,,
Maniacal Anime Magical Girl Villainess (Teen Female),"High-pitched, melodic, cackling teen female audio. A voice that is simultaneously cute and utterly psychotic, enjoying destruction. Fast, erratic, high-pitched pace.",https://s3.renderplatform.com/public-testing/examples/2025-09-24/82_maniacal-anime-magical-girl-villainess-teen-female.mp3,https://s3.renderplatform.com/user-assets/preview/gr_b0262cc5b4a141cb8a26062e1be459a8.png,,,,
Grumpy Plumber (Middle-aged Male),"Gravelly, complaining, muffled middle-aged male audio. A deep, cynical voice (often slightly muffled), assessing bad pipework with profound disgust. Slow, grumbling pace.",https://s3.renderplatform.com/public-testing/examples/2025-09-24/83_grumpy-plumber-middle-aged-male.mp3,https://s3.renderplatform.com/user-assets/preview/gr_9fc88e72b768420aaba707a07d9f8c3f.png,,,,
Nosy Small-Town Librarian (Middle-aged Female),"Sharp, sibilant, whispering middle-aged female audio. A precise, judgmental voice (New England accent), reporting gossip in a loud, stage-whisper. Fast, hushed, piercing pace.",https://s3.renderplatform.com/public-testing/examples/2025-09-24/84_nosy-small-town-librarian-middle-aged-female.mp3,https://s3.renderplatform.com/user-assets/preview/gr_3eb8a768cbad49f1813963bad83ca793.png,,,,
Crazy Old Prospector (Senior Male),"High-pitched, raspy, cackling senior male audio. A fast, erratic voice, whispering about ""the motherlode"" one second and shouting at imaginary thieves the next. Fast, manic pace.",https://s3.renderplatform.com/public-testing/examples/2025-09-24/85_crazy-old-prospector-senior-male.mp3,https://s3.renderplatform.com/user-assets/preview/gr_669b865207e24d1080ecca18516550f4.png,,,,
Overly-Protective Mother (Middle-aged Female),"Warm, fast, anxious middle-aged female audio. A loving voice that rapidly escalates into high-pitched worry, asking too many questions. Fast, cyclical, worried pace.",https://s3.renderplatform.com/public-testing/examples/2025-09-24/86_overly-protective-mother-middle-aged-female.mp3,https://s3.renderplatform.com/user-assets/preview/gr_2c6b1684a3e64f9a9f65c3f9e950c72d.png,,,,
Bored Anime Teacher (Middle-aged Male),"Monotone, slow, droning middle-aged male audio. A completely flat, uninspired voice, reading directly from a textbook with zero enthusiasm. Very slow, monotonous pace.",https://s3.renderplatform.com/public-testing/examples/2025-09-24/87_bored-anime-teacher-middle-aged-male.mp3,https://s3.renderplatform.com/user-assets/preview/gr_73ddf53dde54492a9606c4d1473f4e47.png,,,,
Authoritative Teenage Lifeguard (Teen Female),"Loud, sharp, nasal teen female audio. A young voice, projecting authority by shouting ""Walk!"" and ""No running!"" with sharp, repetitive blasts. Fast, sharp pace.",https://s3.renderplatform.com/public-testing/examples/2025-09-24/88_authoritative-teenage-lifeguard-teen-female.mp3,https://s3.renderplatform.com/user-assets/preview/gr_d8680250d2aa4feeb87f086835a023fc.png,,,,
Dwarven Ale Brewer (Middle-aged Male),"Booming, hearty, warm middle-aged male audio. A deep, laughing voice (Scottish/Irish accent), passionately describing his brew with joy. Moderate, enthusiastic pace.",https://s3.renderplatform.com/public-testing/examples/2025-09-24/89_dwarven-ale-brewer-middle-aged-male.mp3,https://s3.renderplatform.com/user-assets/preview/gr_9144684ece304ce996f63700f899fd43.png,,,,
Elven Mystic (Senior Female),"Smooth, ethereal, echoing senior female audio. An ancient, calm voice, speaking cryptic prophecies with otherworldly detachment. Very slow, melodic pace.",https://s3.renderplatform.com/public-testing/examples/2025-09-24/90_elven-mystic-senior-female.mp3,https://s3.renderplatform.com/user-assets/preview/gr_f285daf6cd2b4675ba585acc001ac67b.png,,,,
Arrogant Roman Senator (Senior Male),"Deep, projecting, articulate senior male audio. A highly educated, booming voice (Classical British accent), delivering speeches with arrogance and grand gestures. Slow, declarative, rhythmic pace.",https://s3.renderplatform.com/public-testing/examples/2025-09-24/91_arrogant-roman-senator-senior-male.mp3,https://s3.renderplatform.com/user-assets/preview/gr_c9fb7fb28ed84d8586903c6718b667e6.png,,,,
Awkward Office Intern (Teen Male),"High-pitched, stammering, quiet teen male audio. A nervous, cracking voice, apologizing for existing and asking basic questions. Slow, hesitant, shaky pace.",https://s3.renderplatform.com/public-testing/examples/2025-09-24/92_awkward-office-intern-teen-male.mp3,https://s3.renderplatform.com/user-assets/preview/gr_d5912e0018fd48678f8b22b9cc94ea0e.png,,,,
Space Station Botanist (Middle-aged Female),"Warm, intelligent, crisp middle-aged female audio. A passionate, clear voice, describing the growth of new plants with wonder and scientific precision. Moderate, descriptive pace.",https://s3.renderplatform.com/public-testing/examples/2025-09-24/93_space-station-botanist-middle-aged-female.mp3,https://s3.renderplatform.com/user-assets/preview/gr_c2d43af0a4374f73a5b409a86b40666e.png,,,,
Hardboiled Police Dispatcher (Middle-aged Female),"Calm, fast, monotone middle-aged female audio (radio filter). A nasal, slightly bored voice, rapidly reading codes and locations with zero panic. Very fast, clipped pace.",https://s3.renderplatform.com/public-testing/examples/2025-09-24/94_hardboiled-police-dispatcher-middle-aged-female.mp3,https://s3.renderplatform.com/user-assets/preview/gr_ca16d14b4f194809a7c9d676d6713fe2.png,,,,
Classic Mad Scientist (Senior Male),"High-pitched, manic, cackling senior male audio. An energetic, aristocratic voice (German accent), shouting ""It's alive!"" and laughing maniacally. Fast, erratic, loud pace.",https://s3.renderplatform.com/public-testing/examples/2025-09-24/95_classic-mad-scientist-senior-male.mp3,https://s3.renderplatform.com/user-assets/preview/gr_7c3ff46b270f413eb0a59a03ebc2ed36.png,,,,
Female Teen Tech Vlogger (Teen Female),"Fast, peppy, articulate teen female audio. A clear, friendly voice, rapidly explaining specs and features with genuine, infectious enthusiasm. Very fast, conversational pace.",https://s3.renderplatform.com/public-testing/examples/2025-09-24/96_female-teen-tech-vlogger-teen-female.mp3,https://s3.renderplatform.com/user-assets/preview/gr_d902a10a52a44fd6a9d24621e79d013f.png,,,,
Burned-Out ER Doctor (Middle-aged Male),"Fast, clipped, exhausted middle-aged male audio. A deep, tired voice, delivering diagnoses and orders with cynical detachment and rapid precision. Fast, monotone, weary pace.",https://s3.renderplatform.com/public-testing/examples/2025-09-24/97_burned-out-er-doctor-middle-aged-male.mp3,https://s3.renderplatform.com/user-assets/preview/gr_7452da81242e48d9b8d05d686bfe38c6.png,,,,
Gossiping Southern Belle (Middle-aged Female),"Melodic, warm, fast-paced middle-aged female audio. A strong Southern drawl, delivering sharp gossip with a deceptively sweet, laughing tone. Fast, rhythmic, conspiratorial pace.",https://s3.renderplatform.com/public-testing/examples/2025-09-24/98_gossiping-southern-belle-middle-aged-female.mp3,https://s3.renderplatform.com/user-assets/preview/gr_b6b7df3016b547fa87d981590b6f9530.png,,,,
Weary Ancient Vampire (Senior Male),"Deep, resonant, slow senior male audio. A cultured European accent, speaking of centuries of boredom, melancholy, and detachment. Very slow, melancholic pace.",https://s3.renderplatform.com/public-testing/examples/2025-09-24/99_weary-ancient-vampire-senior-male.mp3,https://s3.renderplatform.com/user-assets/preview/gr_9ef92d088bae47c5a588c82ec7860a17.png,,,,
Teenage Debate Captain (Teen Male),"Extremely fast, articulate, monotone teen male audio. A sharp, clear voice, delivering a ""spread"" (reading arguments at impossible speed) with no pauses for breath. Extremely fast, aggressive pace.",https://s3.renderplatform.com/public-testing/examples/2025-09-24/100_teenage-debate-captain-teen-male.mp3,https://s3.renderplatform.com/user-assets/preview/gr_764e822227e24cf192722161183c99c4.png,,,,
Fierce Anime Rival (Teen Male),"Loud, gravelly, intense teen male audio. A deep (for a teen), raspy voice, shouting challenges, proclaiming his own strength, and grunting with effort. Fast, aggressive pace.",https://s3.renderplatform.com/public-testing/examples/2025-09-24/01_fierce-anime-rival-teen-male.mp3,https://s3.renderplatform.com/user-assets/preview/gr_535aab2df6cb4559a06093294aad9549.png,,,,
Gentle Female Yoga Instructor (Middle-aged Female),"Soft, smooth, breathy middle-aged female audio. A slow, whispering, ethereal voice, guiding breathing with relentlessly calm positivity. Very slow, rhythmic pace.",https://s3.renderplatform.com/public-testing/examples/2025-09-24/02_gentle-female-yoga-instructor-middle-aged-female.mp3,https://s3.renderplatform.com/user-assets/preview/gr_8ff3c4facb2143a5a2b6bebb118de7cd.png,,,,
Gruff Army General (Middle-aged Male),"Deep, booming, gravelly middle-aged male audio. A sharp, commanding voice (Southern accent), demanding status reports and giving orders with no room for argument. Fast, barking pace.",https://s3.renderplatform.com/public-testing/examples/2025-09-24/03_gruff-army-general-middle-aged-male.mp3,https://s3.renderplatform.com/user-assets/preview/gr_07ac8eed70ae46a3b9746db36db4c807.png,,,,
Flustered English Professor (Senior Male),"Warm, articulate, stammering senior male audio. A brilliant (British RP) voice that constantly loses its place, searching for the right word and sighing. Slow, erratic, intellectual pace.",https://s3.renderplatform.com/public-testing/examples/2025-09-24/04_flustered-english-professor-senior-male.mp3,https://s3.renderplatform.com/user-assets/preview/gr_77ace861c0244280ab3c055a1c8cd15e.png,,,,
Sassy Teen Cashier (Teen Female),"Monotone, sarcastic, nasally teen female audio. A flat, bored voice (heavy vocal fry), delivering required greetings with obvious contempt. Slow, apathetic pace.",https://s3.renderplatform.com/public-testing/examples/2025-09-24/05_sassy-teen-cashier-teen-female.mp3,https://s3.renderplatform.com/user-assets/preview/gr_ea9ac81ed89848e48afd6aef708baa47.png,,,,
Rookie Space Smuggler (Teen Male),"High-pitched, nervous, fast-talking teen male audio. A young voice, trying to sound cool and professional, but cracking under pressure when questioned by authority. Fast, shaky pace.",https://s3.renderplatform.com/public-testing/examples/2025-09-24/06_rookie-space-smuggler-teen-male.mp3,https://s3.renderplatform.com/user-assets/preview/gr_00c14ed512464125b54a1b3878f0aa6b.png,,,,
Doting Grandfather (Senior Male),"Warm, slightly shaky, gentle senior male audio. A slow, chuckling voice, telling stories, asking questions, and offering unconditional praise. Slow, loving pace.",https://s3.renderplatform.com/public-testing/examples/2025-09-24/07_doting-grandfather-senior-male.mp3,https://s3.renderplatform.com/user-assets/preview/gr_47b3cf46ac3e4cccad9da11da7b9ed58.png,,,,
Scheming Corporate Executive (Middle-aged Female),"Smooth, cold, articulate middle-aged female audio. A precise, neutral voice, delivering ruthless business plans with a calm, smiling, sociopathic detachment. Moderate, precise pace.",https://s3.renderplatform.com/public-testing/examples/2025-09-24/08_scheming-corporate-executive-middle-aged-female.mp3,https://s3.renderplatform.com/user-assets/preview/gr_cb8869d567f04f709ab2907acf8cdb5b.png,,,,
Classic Animated Princess (Teen Female),"High-pitched, melodic, singing teen female audio. An overly optimistic, sweet voice, speaking to animals and singing about her dreams. Moderate, flowing, whimsical pace.",https://s3.renderplatform.com/public-testing/examples/2025-09-24/09_classic-animated-princess-teen-female.mp3,https://s3.renderplatform.com/user-assets/preview/gr_24604f132a544ab08f5845b5ae718d27.png,,,,
Grumpy Cartoon Neighbor (Middle-aged Male),"Nasally, loud, complaining middle-aged male audio. A classic animated ""grump"" voice, shouting at the protagonist kid to get off his lawn. Fast, angry, barking pace.",https://s3.renderplatform.com/public-testing/examples/2025-09-24/10_grumpy-cartoon-neighbor-middle-aged-male.mp3,https://s3.renderplatform.com/user-assets/preview/gr_dbcc13ae3469414cb9198fb248dc4289.png,,,,
Female Victorian Street Merchant (Middle-aged Female),"Loud, raspy, fast middle-aged female audio. A strong Cockney accent, shouting repetitive, rhythmic calls to sell her wares (flowers, pies). Fast, rhythmic pace.",https://s3.renderplatform.com/public-testing/examples/2025-09-24/11_female-victorian-street-merchant-middle-aged-female.mp3,https://s3.renderplatform.com/user-assets/preview/gr_0cfd3894c1f648d8a58352003645dfb6.png,,,,
Lazy College Student (Teen Male),"Slow, mumbling, low-energy teen male audio. A tired voice, barely audible, questioning why the class is so early and sighing. Very slow, monotone pace.",https://s3.renderplatform.com/public-testing/examples/2025-09-24/12_lazy-college-student-teen-male.mp3,https://s3.renderplatform.com/user-assets/preview/gr_d2dc6e5cc94d4c22aba14c99d8eec0fe.png,,,,
Space Academy Drill Instructor (Senior Female),"Sharp, loud, commanding senior female audio. A crisp, authoritative voice (British RP accent), demanding precision and insulting new recruits with cold intelligence. Fast, clipped, sharp pace.",https://s3.renderplatform.com/public-testing/examples/2025-09-24/13_space-academy-drill-instructor-senior-female.mp3,https://s3.renderplatform.com/user-assets/preview/gr_78b0249cd63146d0809c37c65902f450.png,,,,
Precise Dwarven Jeweler (Middle-aged Male),"Quiet, focused, gravelly middle-aged male audio. A low, meticulous voice (Scottish accent), whispering about facets, quality, and ancient craft. Slow, precise pace.",https://s3.renderplatform.com/public-testing/examples/2025-09-24/14_precise-dwarven-jeweler-middle-aged-male.mp3,https://s3.renderplatform.com/user-assets/preview/gr_31c122cbf2ec4a4eba5e51fc959ee946.png,,,,
Terrified Space Colonist (Middle-aged Female),"Panicked, breathless, shaky middle-aged female audio (over comms). A screaming, frantic voice, describing an alien attack with pure terror. Fast, hysterical pace.",https://s3.renderplatform.com/public-testing/examples/2025-09-24/15_terrified-space-colonist-middle-aged-female.mp3,https://s3.renderplatform.com/user-assets/preview/gr_e8266bf781754fefae52ff116d3da473.png,,,,
Wise Ancient Monk (Senior Male),"Deep, calm, resonant senior male audio. A slow, peaceful voice (Asian accent), delivering cryptic wisdom and proverbs with serene patience. Very slow, measured pace.",https://s3.renderplatform.com/public-testing/examples/2025-09-24/16_wise-ancient-monk-senior-male.mp3,https://s3.renderplatform.com/user-assets/preview/gr_a97720aa1a874feb8988f90c56ae512c.png,,,,
