voice title,voice description,reference_audio,preview_image (svdq_fluxdev_fp4),SVDQ-Images,preview_audio (tts_mgm),Tags,MGM WER
Warm Bedtime Storyteller (Middle-aged Female),"Pristine studio-quality audio, intimate and comforting, featuring a middle-aged  female storyteller. Their voice is soft, gentle, and soothing, with a melodic quality designed to lull a child to sleep. They speak with a neutral Standard American accent at a slow, deliberate, and rhythmic pace, using gentle inflections for characters.",https://s3.renderplatform.com/public-testing/examples/2025-09-24/41_warm-bedtime-storyteller.mp3,https://s3.renderplatform.com/user-assets/preview/gr_b0f04f572d4a49a89b40803b209d19ec.png,,https://s3.renderplatform.com/user-assets/preview/generated_audio/gr_d5923fb7d1f4413d9e11689818474c68.mp3,"Middle-aged, Female",
Horror Tale Narrator Chilling (Middle-aged Male),"Pristine studio-quality audio, with a subtle, unsettling reverb, featuring a middle-aged female narrator. Their voice is deep, smooth, and inherently chilling, delivered with an insidious calm that instills dread. They speak with a clear, ominous Standard English accent, at a slow, deliberate, and suspenseful pace, utilizing dramatic pauses to maximize terror.",https://s3.renderplatform.com/public-testing/examples/2025-09-24/42_horror-tale-narrator-chilling.mp3,https://s3.renderplatform.com/user-assets/preview/gr_1690dfe1f8bf4c28832d2e38e613e7ca.png,,https://s3.renderplatform.com/user-assets/preview/generated_audio/gr_f60537333f6d454ca31ca793230c3d0a.mp3,"Middle-aged, Male",
Fantasy Epic Narrator (Middle-aged Male),"Pristine studio-quality audio, rich and resonant, featuring a middle-aged male narrator. Their voice is deep, majestic, and inherently captivating, bringing grand fantasy worlds and heroic sagas to life with an epic scope. They speak with a refined British or Standard American accent, at a measured, flowing, and dramatic pace, with pauses that emphasize pivotal moments.",https://s3.renderplatform.com/public-testing/examples/2025-09-24/43_fantasy-epic-narrator.mp3,https://s3.renderplatform.com/user-assets/preview/gr_88b3d396de52406ca9789996ff83d820.png,,https://s3.renderplatform.com/user-assets/preview/generated_audio/gr_88195b5d51424f7f8b9f99fb635fd089.mp3,"Middle-aged, Male",
Romantic Novel Reader Soft (Middle-aged Female),"Pristine studio-quality audio, smooth and intimate, featuring middle-aged female reader. Their voice is soft, gentle, and inherently alluring, exuding warmth and tendernessperfect for romantic prose. They speak with a neutral Standard American accent at a slow, flowing, and sensual pace, with expressive pauses that convey emotional depth.",https://s3.renderplatform.com/public-testing/examples/2025-09-24/45_romantic-novel-reader-soft.mp3,https://s3.renderplatform.com/user-assets/preview/gr_aa99d78ed1bf4883bb25081b5f476ab5.png,,https://s3.renderplatform.com/user-assets/preview/generated_audio/gr_e4be56ef5b764f92a500b341f3c308fd.mp3,"Middle-aged, Female",
Poetry Reciter Melodic (Middle-aged Male),"Pristine studio-quality audio, rich and resonant, featuring a middle-aged male reciter. Their voice is smooth, melodic, and highly expressive, delivering poetic verses with natural rhythm and profound emotional depth. They speak with a refined British or Standard American accent at a slow, deliberate, and rhythmic pace.",https://s3.renderplatform.com/public-testing/examples/2025-09-24/46_poetry-reciter-melodic.mp3,https://s3.renderplatform.com/user-assets/preview/gr_0e109ecf880e4287a4ed575175c64b46.png,,https://s3.renderplatform.com/user-assets/preview/generated_audio/gr_6c3028ef97cd496fa6c3e0083d936b0b.mp3,"Middle-aged, Male",
Fairytale Narrator Whimsical (Middle-aged Female),"Pristine studio-quality audio, bright and enchanting, featuring a middle-aged female narrator. Their voice is warm, gentle, and inherently whimsical, creating a magical atmosphere with playful inflections. They speak with a clear Standard American or refined British accent at a moderate, flowing, and often musical pace.",https://s3.renderplatform.com/public-testing/examples/2025-09-24/47_fairytale-narrator-whimsical.mp3,https://s3.renderplatform.com/user-assets/preview/gr_9016aec1d5614ab19492c549bdf16691.png,,https://s3.renderplatform.com/user-assets/preview/generated_audio/gr_60a2769c5a4349bcaabc2112175fd84f.mp3,"Middle-aged, Female",
Gothic Tale Narrator (Middle-aged Male),"Pristine studio-quality audio, deep and atmospheric, perhaps with a subtle, haunting echo, featuring a middle-aged male narrator. The voice is low-pitched, resonant, and somber, delivered with brooding mystery and elegant dread. Refined British accent at a slow, deliberate, melancholic pace with dramatic pauses.",https://s3.renderplatform.com/public-testing/examples/2025-09-24/48_gothic-tale-narrator.mp3,https://s3.renderplatform.com/user-assets/preview/gr_926bf6a41d5347b79081f0f1e1f37e0d.png,,https://s3.renderplatform.com/user-assets/preview/generated_audio/gr_97d95e41e4424cb5a710700616aeb995.mp3,"Middle-aged, Male",
Comedy Audiobook Voice Witty (Middle-aged Male),"Pristine studio-quality audio, bright and engaging, featuring a middle-aged male narrator. Energetic, highly expressive, and naturally witty, delivering punchlines and comedic timing with precision. Standard American accent at a lively, conversational, often quick pace with well-placed pauses.",https://s3.renderplatform.com/public-testing/examples/2025-09-24/49_comedy-audiobook-voice-witty.mp3,https://s3.renderplatform.com/user-assets/preview/gr_c7d7487973184f6c94923ca3d783ee63.png,,https://s3.renderplatform.com/user-assets/preview/generated_audio/gr_5c29d19e869b448cb8aa3bdfa4ab177f.mp3,"Middle-aged, Male",
Thriller Narrator Tense Pacing (Middle-aged Male),"Pristine studio-quality audio, sharp and urgent, featuring a middle-aged narrator. Low-pitched, intense, often breathycontrolled urgency that builds palpable tension. Standard American accent at a fast, clipped, suspenseful pace with abrupt pauses.",https://s3.renderplatform.com/public-testing/examples/2025-09-24/50_thriller-narrator-tense-pacing.mp3,https://s3.renderplatform.com/user-assets/preview/gr_5915c205b1fe46f9ae50b1f72357822d.png,,https://s3.renderplatform.com/user-assets/preview/generated_audio/gr_51b702d0c8614d2f8b4509540de7290a.mp3,"Middle-aged, Male",
History Audiobook Narrator (Middle-aged Male),"Pristine studio-quality audio, rich and authoritative, featuring a middle-aged male narrator. Deep, clear, and profoundly knowledgeable, presenting history with gravitas and engaging detail. Neutral Standard American or refined British accent at a measured, deliberate, informative pace.",https://s3.renderplatform.com/public-testing/examples/2025-09-24/51_history-audiobook-narrator.mp3,https://s3.renderplatform.com/user-assets/preview/gr_1f00f02f1b1f426db166a86f327617cc.png,,https://s3.renderplatform.com/user-assets/preview/generated_audio/gr_9b34bb1425cd4251a9ac338f354ce46d.mp3,"Middle-aged, Male",
Travelogue Narrator Lively (Middle-aged Male),"Pristine studio-quality audio, bright and descriptive, featuring a  middle-aged male narrator. Energetic, enthusiastic, and highly expressive, painting vivid pictures of distant lands and cultures. Standard American (or relevant regional) accent at a lively, descriptive, engaging pace.",https://s3.renderplatform.com/public-testing/examples/2025-09-24/52_travelogue-narrator-lively.mp3,https://s3.renderplatform.com/user-assets/preview/gr_442f80f6ec47470bbca1f06e49e13ab4.png,,https://s3.renderplatform.com/user-assets/preview/generated_audio/gr_10f601ca25404adfbe492d9351ba0cf6.mp3,"Middle-aged, Male",
Self-Help Narrator Calm (Middle-aged Male),"Pristine studio-quality audio, clear and soothing, featuring a middle-aged male narrator. Soft, warm, profoundly calmradiating reassurance and gentle guidance. Neutral Standard American accent at a slow, measured, comforting pace.",https://s3.renderplatform.com/public-testing/examples/2025-09-24/53_self-help-narrator-calm.mp3,https://s3.renderplatform.com/user-assets/preview/gr_6a19cbec64c64b50807168b75aa8efb5.png,,https://s3.renderplatform.com/user-assets/preview/generated_audio/gr_fb2f17177c0c4b318b59048a0bae23dc.mp3,"Middle-aged, Male",
Motivational Audiobook Narrator (Middle-aged Male),"Pristine studio-quality audio, powerful and inspiring, featuring a middle-aged male narrator. Strong, energetic, highly articulateexuding confidence and motivating enthusiasm. Standard American accent at a moderate-to-fast, dynamic, uplifting pace.",https://s3.renderplatform.com/public-testing/examples/2025-09-24/54_motivational-audiobook-narrator.mp3,https://s3.renderplatform.com/user-assets/preview/gr_c5ef31b628f7453a86f30ac6a594aa1d.png,,https://s3.renderplatform.com/user-assets/preview/generated_audio/gr_0aa77b8062ce43ae9b8d7ba2393215db.mp3,"Middle-aged, Male",
Classic Literature Reader (Middle-aged Male),"Pristine studio-quality audio, refined and eloquent, featuring a middle-aged male  reader. Deep, clear, and highly articulate, delivering classic prose with grace and nuance. Refined British or neutral Standard American accent at a slow, deliberate, flowing pace.",https://s3.renderplatform.com/public-testing/examples/2025-09-24/55_classic-literature-reader.mp3,https://s3.renderplatform.com/user-assets/preview/gr_73673b69456849ccac93bd1d31afb416.png,,https://s3.renderplatform.com/user-assets/preview/generated_audio/gr_692700360afe4921b439ef9c6dd85774.mp3,"Middle-aged, Male",
Mythology Reteller Dramatic (Middle-aged Male),"Pristine studio-quality audio, rich and theatrical, featuring a middle-aged male reteller. Deep, resonant, inherently dramaticbringing myths to life with epic scope. Refined, ancient-sounding accent at a slow, deliberate, impactful pace with dramatic pauses.",https://s3.renderplatform.com/public-testing/examples/2025-09-24/56_mythology-reteller-dramatic.mp3,https://s3.renderplatform.com/user-assets/preview/gr_68deeae88c0d4fa7ae9e843d34cc018e.png,,https://s3.renderplatform.com/user-assets/preview/generated_audio/gr_96988d254eeb477082aa1d719e65d96b.mp3,"Middle-aged, Male",
Kids Audiobook Narrator Fun (Middle-aged Male),"Pristine studio-quality audio, bright and engaging, featuring a versatile narrator. Warm, energetic, playfulcapable of multiple character voices. Standard American or refined British accent at a lively, animated, quick pace to spark imagination.",https://s3.renderplatform.com/public-testing/examples/2025-09-24/57_kid-s-audiobook-narrator-fun.mp3,https://s3.renderplatform.com/user-assets/preview/gr_2b518ce64e8c4b9585a8ce94df49393d.png,,https://s3.renderplatform.com/user-assets/preview/generated_audio/gr_a2556bcb802f44f79b844cc26cb950d0.mp3,"Middle-aged, Male",
Sci-Fi Novel Reader (Middle-aged Male),"Pristine studio-quality audio featuring middle-aged male, clean and forward-thinking, perhaps with a subtle futuristic filter, featuring a cool, analytical narrator. Neutral Standard American accent at a moderate, precise, slightly detached pace for complex concepts.",https://s3.renderplatform.com/public-testing/examples/2025-09-24/58_sci-fi-novel-reader.mp3,https://s3.renderplatform.com/user-assets/preview/gr_fa13e13066394d108c965608e7f069a7.png,,https://s3.renderplatform.com/user-assets/preview/generated_audio/gr_1577791708a548acb35892159221e2fc.mp3,"Middle-aged, Male",
Drama Narrator Heavy Pauses (Middle-aged Male),"Pristine studio-quality audio, deep and impactful, featuring a serious middle-aged male narrator. Low-pitched, rich, and gravedelivering drama with intense gravitas. Standard American accent at a slow, deliberate, often halting pace with heavy pauses.",https://s3.renderplatform.com/public-testing/examples/2025-09-24/59_drama-narrator-heavy-pauses.mp3,https://s3.renderplatform.com/user-assets/preview/gr_9e87eda1413242d790d6fb419a3872c8.png,,https://s3.renderplatform.com/user-assets/preview/generated_audio/gr_8a087c2d0835457b85391d26447cbd78.mp3,"Middle-aged, Male",
Action-Adventure Narrator (Middle-aged Male),"Pristine studio-quality audio, dynamic and energetic, featuring a highly engaging middle-aged male narrator. Strong, vibrant delivery for excitement, danger, and rapid-fire sequences. Standard American accent at a fast, thrilling, accelerating pace.",https://s3.renderplatform.com/public-testing/examples/2025-09-24/60_action-adventure-narrator.mp3,https://s3.renderplatform.com/user-assets/preview/gr_35aac6982e504283b959694efa913add.png,,https://s3.renderplatform.com/user-assets/preview/generated_audio/gr_bdbab7c324f947e38eb9c0783f63397f.mp3,"Middle-aged, Male",
Esports Commentator Hyped (Middle-aged Male),"Broadcast-quality studio recording, high-energy and fast-paced, featuring a midlde-aged male esports commentator. Extremely energetic, loud, enthusiasticrapid-fire play-by-play. Standard American accent at an incredibly fast, breathless, hyped pace.",https://s3.renderplatform.com/public-testing/examples/2025-09-24/61_esports-commentator-hyped.mp3,https://s3.renderplatform.com/user-assets/preview/gr_438e1fe143854755a05f5a967ca4861a.png,,https://s3.renderplatform.com/user-assets/preview/generated_audio/gr_f2fea6c241fa446991b6b8a884dacab7.mp3,"Middle-aged, Male",
RPG Dungeon Master Immersive (Middle-aged Male),"Pristine studio-quality audio, versatile and atmospheric, featuring a middle-aged male  RPG dungeon master. Deep, engaging, capable of shifting between narration and character voices. Standard American accent at a moderate, descriptive, theatrical pace.",https://s3.renderplatform.com/public-testing/examples/2025-09-24/62_rpg-dungeon-master-immersive.mp3,https://s3.renderplatform.com/user-assets/preview/gr_f9112a5ccc2f44f893be2b249d8d69ba.png,,https://s3.renderplatform.com/user-assets/preview/generated_audio/gr_4e06a130a7194969b44d071783f8bed0.mp3,"Middle-aged, Male",
MOBA Play-by-Play Announcer (Middle-aged Male),"Broadcast-quality studio recording, incredibly energetic and commanding, featuring a middle-aged male MOBA play-by-play announcer. Loud, booming, exceptionally hypedrapid calls of team fights and plays. Standard American accent at an extremely fast, explosive pace.",https://s3.renderplatform.com/public-testing/examples/2025-09-24/63_moba-play-by-play-announcer.mp3,https://s3.renderplatform.com/user-assets/preview/gr_1cb76b729a4f4385861fde3d3536152d.png,,https://s3.renderplatform.com/user-assets/preview/generated_audio/gr_c32dbc36a67c4e84acb3617b3e5f2b83.mp3,"Middle-aged, Male",
FPS Gamer Trash-Talker (Middle-aged Male),"Low-fidelity, aggressive, slightly distorted live-chat vibe, featuring a middle-aged male competitive FPS gamer. High-pitched, energetic, often aggressive taunts with sarcastic edge. Standard American accent at a fast, erratic, often shouting pace.",https://s3.renderplatform.com/public-testing/examples/2025-09-24/64_fps-gamer-trash-talker.mp3,https://s3.renderplatform.com/user-assets/preview/gr_7d26c9b95e54492e9e0a8133969336f3.png,,https://s3.renderplatform.com/user-assets/preview/generated_audio/gr_304e0c1ab683452ab9916791c1c8abcf.mp3,"Middle-aged, Male",
Streamer with Over-the-Top Reactions (Middle-aged Male),"Broadcast-quality studio audio, vibrant and highly expressive, featuring a middle-aged male entertainer streamer. Energetic, often high-pitched, prone to exaggerated shouts and dramatic gasps. Standard American accent at a fast, animated, erratic pace.",https://s3.renderplatform.com/public-testing/examples/2025-09-24/65_streamer-with-over-the-top-reactions.mp3,https://s3.renderplatform.com/user-assets/preview/gr_92accd8746bb423d9bc88918e0529f36.png,,https://s3.renderplatform.com/user-assets/preview/generated_audio/gr_81d1e0b3b504457e9d68c28bdf01119a.mp3,"Middle-aged, Male",
Speedrunner Explaining Calmly (Middle-aged Male),"Pristine studio-quality audio, clear and focused, featuring a middle-aged male calm, highly articulate speedrunner. Precise explanations of complex mechanics delivered with composure. Standard American accent at a moderate, steady, precise pace.",https://s3.renderplatform.com/public-testing/examples/2025-09-24/66_speedrunner-explaining-calmly.mp3,https://s3.renderplatform.com/user-assets/preview/gr_5bba9b906bbb4e789abdbdaa121f597c.png,,https://s3.renderplatform.com/user-assets/preview/generated_audio/gr_76d4d7c0d27745adbea18ea1161dff4b.mp3,"Middle-aged, Male",
VR Game Narrator Futuristic (Middle-aged Female),"Pristine studio-quality audio, clean and immersive with a subtle futuristic sheen, featuring a middle-aged female VR narrator. Smooth, slightly synthesized tone guiding players with cool authority. Unaccented Standard English at a moderate, precise pace.",https://s3.renderplatform.com/public-testing/examples/2025-09-24/67_vr-game-narrator-futuristic.mp3,https://s3.renderplatform.com/user-assets/preview/gr_d1a80878c6664e6d9a035cc3a453917d.png,,https://s3.renderplatform.com/user-assets/preview/generated_audio/gr_9eee08e89572433e846c42e06af0c629.mp3,"Middle-aged, Female",
Retro Arcade Game Announcer (Middle-aged Male),"Low-fidelity, slightly distorted, highly energeticmimicking classic arcade systemsfeaturing a middle-aged male booming announcer. Deep, enthusiastic delivery with exaggerated, punchy flair. Classic Standard American accent at a fast, rhythmic pace.",https://s3.renderplatform.com/public-testing/examples/2025-09-24/68_retro-arcade-game-announcer.mp3,https://s3.renderplatform.com/user-assets/preview/gr_5b2683f9c156492ea6501de76f83d314.png,,https://s3.renderplatform.com/user-assets/preview/generated_audio/gr_dae20b29ac7945f3ba105b65ba28638d.mp3,"Middle-aged, Male",
Strategy Game Commentator (Middle-aged Male),"Broadcast-quality studio recording, clear and analytical, featuring a thoughtful middle-aged male strategist. Intelligent, composed, highly articulate analysis of tactics and decisions. Standard American accent at a moderate, precise, analytical pace.",https://s3.renderplatform.com/public-testing/examples/2025-09-24/69_strategy-game-commentator.mp3,https://s3.renderplatform.com/user-assets/preview/gr_b49e873dc3f84d92bb35041ea8efae45.png,,https://s3.renderplatform.com/user-assets/preview/generated_audio/gr_0cacab142db04ea4a9494487e7229d0a.mp3,"Middle-aged, Male",
Sports Game Commentator (Middle-aged Male),"Broadcast-quality studio recording, energetic and descriptive, featuring a passionate middle-aged male sports commentator. High-energy, dynamic play-by-play with enthusiastic reactions. Standard American accent at a fast, excitable, reactive pace.",https://s3.renderplatform.com/public-testing/examples/2025-09-24/70_sports-game-commentator.mp3,https://s3.renderplatform.com/user-assets/preview/gr_6b601773ebc94ab5865cc7d9904cdcec.png,,https://s3.renderplatform.com/user-assets/preview/generated_audio/gr_855b5d0dec4d4410a3a625babe1e17b3.mp3,"Middle-aged, Male",
Fighting Game Announcer Energetic (Middle-aged Male),"Broadcast-quality studio recording, loud and impactful, featuring a powerful middle-aged male fighting game announcer. Deep, booming, exceptionally energetic with theatrical flair. Strong Standard American accent at a fast, punchy, impactful pace.",https://s3.renderplatform.com/public-testing/examples/2025-09-24/71_fighting-game-announcer-energetic.mp3,https://s3.renderplatform.com/user-assets/preview/gr_9f0da5d5841f4e75b8401974146fe932.png,,https://s3.renderplatform.com/user-assets/preview/generated_audio/gr_ae7f7c7f195d46d28abc808d4f6bdf5c.mp3,"Middle-aged, Male",
Fantasy Quest Narrator (Middle-aged Male),"Pristine studio-quality audio, rich and evocative, featuring a middle-aged male captivating quest narrator. Deep, engaging voice that brings imaginative quests to life. Refined British or Standard American accent at a measured, flowing, descriptive pace.",https://s3.renderplatform.com/public-testing/examples/2025-09-24/72_fantasy-quest-narrator.mp3,https://s3.renderplatform.com/user-assets/preview/gr_2355656a668749779e7ff199708c6f9b.png,,https://s3.renderplatform.com/user-assets/preview/generated_audio/gr_7481673abf4e456dbd255e863113a089.mp3,"Middle-aged, Male",
In-Game Villain Boss Voice (Senior Male),"Pristine studio-quality audio, deep and menacing, possibly with subtle distortion or echo, featuring an older terrifying boss. Guttural, powerful, profoundly threatening taunts and commands. Stylized demonic/monstrous accent at a slow, terrifying pace.",https://s3.renderplatform.com/public-testing/examples/2025-09-24/73_in-game-villain-boss-voice.mp3,https://s3.renderplatform.com/user-assets/preview/gr_93a39c31408041c49532b18e9b09a164.png,,https://s3.renderplatform.com/user-assets/preview/generated_audio/gr_0fdf9e104528416da3ecb5a6ba400a34.mp3,"Senior, Male",
NPC Quest Giver Monotone (Middle-aged Female),"Clean studio-quality audio, slightly flat, featuring a middle-aged female NPC quest giver. Clear, articulate, distinctly monotone instructions with emotionless consistency. Neutral, unaccented English at a steady, even, deliberate pace.",https://s3.renderplatform.com/public-testing/examples/2025-09-24/74_npc-quest-giver-monotone.mp3,https://s3.renderplatform.com/user-assets/preview/gr_9889fdf49f4644e6b26b101e30124f1d.png,,https://s3.renderplatform.com/user-assets/preview/generated_audio/gr_873bcfb5814f4df6b88a7a718518578b.mp3,"Middle-aged, Female",
Merchant NPC Chatty (Middle-aged Male),"Clean studio-quality audio with subtle shop ambiance, featuring a middle-aged male friendly merchant. Warm, chatty delivery eager to pitch wares. Standard American or fantasy regional accent at a fast, energetic, conversational pace.",https://s3.renderplatform.com/public-testing/examples/2025-09-24/75_merchant-npc-chatty.mp3,https://s3.renderplatform.com/user-assets/preview/gr_355e65ee12124a00a03c02dd48952413.png,,https://s3.renderplatform.com/user-assets/preview/generated_audio/gr_28079fef8433452e92ccb0463a72a35c.mp3,"Middle-aged, Male",
RPG Healer NPC Kind (Middle-aged Female),"Pristine studio-quality audio, gentle and comforting, featuring a middle-aged female compassionate healer NPC. Soft, warm, empathetic tone with soothing presence. Neutral Standard English accent at a slow, gentle, reassuring pace.",https://s3.renderplatform.com/public-testing/examples/2025-09-24/76_rpg-healer-npc-kind.mp3,https://s3.renderplatform.com/user-assets/preview/gr_b407f26a9d0e4fc9a6a5878f1cd0bc21.png,,https://s3.renderplatform.com/user-assets/preview/generated_audio/gr_345c380812f840ff9f439e3c77c464c6.mp3,"Middle-aged, Female",
Quest Narrator Whimsical (Middle-aged Female),"Pristine studio-quality audio, bright and enchanting, featuring a middle-aged female playful quest narrator. Warm, gentle, whimsical guidance through fantastical adventures. Standard American or refined British accent at a moderate, musical pace.",https://s3.renderplatform.com/public-testing/examples/2025-09-24/77_quest-narrator-whimsical.mp3,https://s3.renderplatform.com/user-assets/preview/gr_2ee39f358c374ea2901732c259477dd0.png,,https://s3.renderplatform.com/user-assets/preview/generated_audio/gr_5b0446d19ab54bdd8896c7956d7a8484.mp3,"Middle-aged, Female",
Battle Royale Announcer (Middle-aged Male),"Broadcast-quality studio recording, loud and impactful, featuring a middle-aged male intense BR announcer. Deep, booming energy for kill feeds and victory calls with theatrical flair. Strong Standard American accent at a fast, punchy, impactful pace.",https://s3.renderplatform.com/public-testing/examples/2025-09-24/78_battle-royale-announcer.mp3,https://s3.renderplatform.com/user-assets/preview/gr_6ec141fcb82741558103fa19017965eb.png,,https://s3.renderplatform.com/user-assets/preview/generated_audio/gr_8b3f1a8c9e27421f855cde3158cd5f33.mp3,"Middle-aged, Male",
Survival Game Narrator Tense (Middle-aged Male),"Low-fidelity, raw, urgent studio-quality audio with environmental ambiance, featuring a middle-aged male tense survival narrator. Low-pitched, intense, breathy delivery with controlled urgency. Standard American accent at a fast, clipped, suspenseful pace.",https://s3.renderplatform.com/public-testing/examples/2025-09-24/79_survival-game-narrator-tense.mp3,https://s3.renderplatform.com/user-assets/preview/gr_46889c39f7834b1a9f6d1544c4359a8e.png,,https://s3.renderplatform.com/user-assets/preview/generated_audio/gr_cf40fdcfd3494dcfabc1b10607b04e33.mp3,"Middle-aged, Male",
Sim Game Narrator Cheerful (Middle-aged Female),"Pristine studio-quality audio, bright and optimistic, featuring a middle-aged cheerful simulator narrator. Energetic, friendly, consistently positive guidance. Standard American accent at a moderate-to-fast, lively, conversational pace.",https://s3.renderplatform.com/public-testing/examples/2025-09-24/80_sim-game-narrator-cheerful.mp3,https://s3.renderplatform.com/user-assets/preview/gr_25fddd7f416e412ba94aa74ed97221a0.png,,https://s3.renderplatform.com/user-assets/preview/generated_audio/gr_66ddd80a6e3c43eda710d9f2d68423c5.mp3,"Middle-aged, Female",
"Shakespearean king, thunderous and poetic (Senior Male)","Pristine studio-quality audio, resonant and grand, featuring an older male Shakespearean king. His voice is deep, booming, and profoundly theatrical, delivering poetic verse with commanding authority and dramatic flair. He speaks with a refined RP (Received Pronunciation) British accent, at a majestic, deliberate pace, utilizing powerful pauses for dramatic emphasis and tragic gravitas.",https://s3.renderplatform.com/public-testing/examples/2025-09-24/01_shakespearean-king-thunderous-and-poetic.mp3,https://s3.renderplatform.com/user-assets/preview/gr_21ccdd88621d4973bf1fa6e3a9983020.png,,https://s3.renderplatform.com/user-assets/preview/generated_audio/gr_54c9e740275d4a5d947d88cdeae7dcb9.mp3,"Senior, Male",
